{
  "uri": "https://schemas.salesforce.com/a2a/ext/agentforce-live/v0.1",
  "description": "Realtime conversation directives",
  "required": false,
  "params": {
    "directiveTypes": [
      "say_exactly",
      "convey",
      "ask_for",
      "confirm_entities",
      "progress",
      "escalate",
      "end_session"
    ]
  }
}
